{
  "kind": "mayBeGenuine",
  "callId": "call_01HZX9P3Q7",
  "protectedUserName": "Mak Siti",
  "stage": "isolation",
  "claimedAgency": "Maybank",
  "summary": "Muse Spark now thinks this may be a genuine Maybank card check: no transfer or TAC was asked for. Still worth a call to Mak Siti.",
  "quotes": [
    "kad kredit berakhir ****5678"
  ],
  "at": "2026-10-27T11:02:40+08:00"
}
